{
  "id": "WP-2026W22-023",
  "type": "art",
  "status": "active",
  "goal": "Prepare transparent prototype asset files from the Phase 3B generated candidates for player, floor/platform, obstacle, and goal marker; update CSV/JSON manifests and write a prep report without importing assets into Godot.",
  "owner_agent": "art",
  "inputs": [
    "art_candidates/phase3b/asset_requirements.csv",
    "art_candidates/phase3b/asset_manifest.csv",
    "art_candidates/phase3b/asset_requirements.json",
    "art_candidates/phase3b/asset_manifest.json",
    "art_candidates/phase3b/individual/P3B-player-v1.png",
    "art_candidates/phase3b/individual/P3B-floor-platform-v1.png",
    "art_candidates/phase3b/individual/P3B-obstacle-v1.png",
    "art_candidates/phase3b/individual/P3B-goal-marker-v1.png",
    "art_candidates/phase3b/individual/P3B-timer-hud-v1.png",
    "implementation_notes/IN-2026W22-001-phase3c-asset-integration-assessment.md",
    "agents/profiles/art_agent.yaml"
  ],
  "targets": [
    "art_candidates/phase3e/prepared/P3E-player-v1-transparent.png",
    "art_candidates/phase3e/prepared/P3E-floor-platform-v1-transparent.png",
    "art_candidates/phase3e/prepared/P3E-obstacle-v1-transparent.png",
    "art_candidates/phase3e/prepared/P3E-goal-marker-v1-transparent.png",
    "art_candidates/phase3e/prepared_preview.png",
    "art_candidates/phase3e/prepared_manifest.csv",
    "art_candidates/phase3e/prepared_manifest.json",
    "art_notes/AN-2026W22-005-transparent-asset-prep-report.md",
    "work_packages/active/WP-2026W22-023.json",
    "runs/RUN-20260531-006.json"
  ],
  "forbidden_changes": [
    "game/**",
    "scripts/**",
    "schemas/**",
    "agents/**",
    "context/**",
    "research_notes/**",
    "implementation_notes/**",
    "owner_reviews/**",
    "reviews/**",
    "learning_cards/**",
    "new creative image generation",
    "Godot import, .import file creation, project.godot mutation, scene mutation, script mutation",
    "final art direction, style bible, production asset approval, or public-release asset usage",
    "movement changes, collision changes, HUD implementation, enemy, item, scoring, camera, web export, or gameplay expansion",
    "Working, Canonical, or Policy Learning Card promotion"
  ],
  "outputs": [
    "art_candidates/phase3e/prepared/P3E-player-v1-transparent.png",
    "art_candidates/phase3e/prepared/P3E-floor-platform-v1-transparent.png",
    "art_candidates/phase3e/prepared/P3E-obstacle-v1-transparent.png",
    "art_candidates/phase3e/prepared/P3E-goal-marker-v1-transparent.png",
    "art_candidates/phase3e/prepared_preview.png",
    "art_candidates/phase3e/prepared_manifest.csv",
    "art_candidates/phase3e/prepared_manifest.json",
    "art_notes/AN-2026W22-005-transparent-asset-prep-report.md",
    "runs/RUN-20260531-006.json"
  ],
  "verify": [
    {
      "name": "Prepared transparent assets exist",
      "method": "command",
      "command": "test -e art_candidates/phase3e/prepared/P3E-player-v1-transparent.png && test -e art_candidates/phase3e/prepared/P3E-floor-platform-v1-transparent.png && test -e art_candidates/phase3e/prepared/P3E-obstacle-v1-transparent.png && test -e art_candidates/phase3e/prepared/P3E-goal-marker-v1-transparent.png"
    },
    {
      "name": "Prepared assets have alpha and transparent corners",
      "method": "command",
      "command": "python3 - <<'PY'\nfrom pathlib import Path\nfrom PIL import Image\nfor path in sorted(Path('art_candidates/phase3e/prepared').glob('*.png')):\n    im = Image.open(path)\n    assert 'A' in im.getbands(), path\n    alpha = im.getchannel('A')\n    corners = [alpha.getpixel(pt) for pt in [(0,0),(im.width-1,0),(0,im.height-1),(im.width-1,im.height-1)]]\n    assert all(v == 0 for v in corners), (path, corners)\nprint('alpha ok')\nPY"
    },
    {
      "name": "Prepared manifests parse",
      "method": "command",
      "command": "python3 - <<'PY'\nimport csv, json\nwith open('art_candidates/phase3e/prepared_manifest.csv', newline='') as f:\n    rows = list(csv.DictReader(f))\nassert len(rows) == 5 and 'prepared_asset_id' in rows[0]\njson.load(open('art_candidates/phase3e/prepared_manifest.json'))\nprint('manifests ok')\nPY"
    },
    {
      "name": "Transparent prep report covers boundaries",
      "method": "command",
      "command": "rg -n \"Prep Scope|Method|Prepared Assets|Validation Results|Quality Risks|Godot Import Boundary|Implementation Handoff|Capability Finding\" art_notes/AN-2026W22-005-transparent-asset-prep-report.md"
    },
    {
      "name": "Transparent prep Work Package validates",
      "method": "command",
      "command": "npx --yes ajv-cli@5.0.0 validate --spec=draft2020 --strict=false -s schemas/work_package.schema.json -d work_packages/active/WP-2026W22-023.json"
    },
    {
      "name": "Transparent prep Run validates",
      "method": "command",
      "command": "npx --yes ajv-cli@5.0.0 validate --spec=draft2020 --strict=false -s schemas/run.schema.json -d runs/RUN-20260531-006.json"
    },
    {
      "name": "No Godot files changed",
      "method": "command",
      "command": "bash -lc 'extra=$(git status --short --untracked-files=all | sed \"s/^...//\" | grep -Ev \"^(art_notes/AN-2026W22-003-art-production-capability-boundary.md|work_packages/active/WP-2026W22-018.json|runs/RUN-20260531-001.json|art_candidates/phase3b/.*|art_notes/AN-2026W22-004-art-production-candidate-report.md|owner_reviews/OR-2026W22-003-phase3b-art-candidates-KR.md|work_packages/active/WP-2026W22-019.json|runs/RUN-20260531-002.json|work_packages/active/WP-2026W22-020.json|runs/RUN-20260531-003.json|implementation_notes/IN-2026W22-001-phase3c-asset-integration-assessment.md|work_packages/active/WP-2026W22-021.json|runs/RUN-20260531-004.json|reviews/RV-20260531-001.json|work_packages/active/WP-2026W22-022.json|runs/RUN-20260531-005.json|art_candidates/phase3e/.*|art_notes/AN-2026W22-005-transparent-asset-prep-report.md|work_packages/active/WP-2026W22-023.json|runs/RUN-20260531-006.json)$\" || true); test -z \"$extra\"'"
    }
  ],
  "handoff_to": [
    "qa",
    "implementation",
    "human_creative_owner",
    "learning_librarian"
  ],
  "human_decision_required": true,
  "human_decision_reason": "BK/Human Creative Owner must decide whether the transparent prepared asset package is good enough to proceed to QA review, implementation import planning, or another Art prep iteration.",
  "acceptance_criteria": [
    "The Work Package prepares transparent prototype assets for player, floor/platform, obstacle, and goal marker only.",
    "Timer/HUD remains explicitly deferred to avoid UI-system scope expansion.",
    "Prepared files are RGBA PNGs with transparent corners.",
    "Prepared CSV and JSON manifests map source required_asset_id and candidate_id to prepared asset paths.",
    "The prep report documents method, validation results, quality risks, Godot import boundary, and implementation handoff questions.",
    "No Godot files, .import files, scripts, schemas, agent profiles, owner reviews, QA reviews, or Learning Cards are changed.",
    "No final art direction, production/public use approval, gameplay expansion, or Godot import is implied."
  ],
  "created_at": "2026-05-31",
  "notes": "This Work Package performs the required Phase 3 transparent asset prep validation in one longer unit. It stops before Godot import."
}
